{
  "id": "vivienda",
  "slug": "vivienda",
  "title": "Vivienda",
  "summary": "Ficha de orientación para estudiar la cuestión de la vivienda como problema social ligado a la explotación, la urbanización capitalista y la reproducción de la clase trabajadora.",
  "editorial_intent": "Entrada recomendada: La cuestión de la vivienda de Engels, que discute directamente propuestas reformistas de su época y sigue siendo el texto de referencia marxista sobre el tema.",
  "status": "reviewed",
  "entry_points": [
    {
      "id": "desde-el-problema-social",
      "label": "Desde el problema social",
      "description": "Empieza por los textos que muestran la vivienda como efecto de relaciones de clase, no como un simple fallo tecnico de gestion urbana."
    }
  ],
  "key_authors": [
    {
      "id": "engels-friedrich",
      "role": "critica socialista de la vivienda bajo el capitalismo",
      "why_relevant": "Es la referencia mas directa para estudiar la cuestion de la vivienda como problema estructural y no meramente moral."
    },
    {
      "id": "marx-karl",
      "role": "contexto de la acumulacion y reproduccion capitalista",
      "why_relevant": "Aporta el marco mas amplio para situar la vivienda dentro de la explotacion, la reproduccion de la fuerza de trabajo y la urbanizacion capitalista."
    }
  ],
  "essential_works": [
    {
      "work_id": "engels-housing-question",
      "level": "introductory",
      "estimated_effort": "medium",
      "reason_to_read": "Es la puerta de entrada central para comprender por que la escasez y el encarecimiento de la vivienda no se resuelven dentro de las relaciones capitalistas."
    },
    {
      "work_id": "engels-condition-working-class",
      "level": "intermediate",
      "estimated_effort": "long",
      "reason_to_read": "Permite ver empiricamente la forma en que hacinamiento, enfermedad y segregacion urbana se articulan con la explotacion industrial."
    },
    {
      "work_id": "marx-capital-volume-one",
      "level": "advanced",
      "estimated_effort": "long",
      "reason_to_read": "Sirve como marco de fondo para situar la vivienda dentro de la acumulacion, la reproduccion de la fuerza de trabajo y la configuracion espacial del capitalismo."
    }
  ],
  "connected_concepts": [
    {
      "id": "urbanizacion",
      "label": "Urbanización",
      "relation": "Relaciona vivienda con concentracion industrial, crecimiento desigual de la ciudad y segregacion espacial."
    },
    {
      "id": "reproduccion-de-la-fuerza-de-trabajo",
      "label": "Reproducción de la fuerza de trabajo",
      "relation": "Permite entender la vivienda como condicion material de vida y trabajo, no como consumo aislado."
    },
    {
      "id": "alquiler",
      "label": "Alquiler",
      "relation": "Abre la cuestion del ingreso de propietarios, renta urbana y endeudamiento popular."
    },
    {
      "id": "salud-publica",
      "label": "Salud pública",
      "relation": "Conecta hacinamiento y vivienda degradada con enfermedad, mortalidad y desigualdad urbana."
    }
  ],
  "historical_debates": [
    {
      "id": "reforma-urbana-o-transformacion-social",
      "label": "Reforma urbana o transformacion social",
      "description": "Debate sobre si el problema de la vivienda puede resolverse mediante mejoras parciales del mercado o si remite a la estructura de propiedad y a la explotacion capitalista.",
      "participant_author_ids": [
        "engels-friedrich",
        "marx-karl"
      ],
      "related_work_ids": [
        "engels-housing-question",
        "marx-capital-volume-one"
      ]
    },
    {
      "id": "miseria-urbana-y-explotacion-industrial",
      "label": "Miseria urbana y explotacion industrial",
      "description": "Debate sobre como vivienda, sanidad, salario y tiempo de trabajo forman parte de un mismo problema social.",
      "participant_author_ids": [
        "engels-friedrich",
        "marx-karl"
      ],
      "related_work_ids": [
        "engels-condition-working-class",
        "marx-capital-volume-one"
      ]
    }
  ],
  "reading_paths": [
    {
      "id": "ruta-basica",
      "label": "Ruta basica",
      "level": "introductory",
      "goal": "Entender la vivienda como problema estructural del capitalismo y no como simple falta de oferta.",
      "steps": [
        {
          "position": 1,
          "work_id": "engels-housing-question",
          "note": "Empezar aqui para fijar la tesis central del tema y el vocabulario basico de la cuestion de la vivienda."
        },
        {
          "position": 2,
          "work_id": "engels-condition-working-class",
          "note": "Continuar con una lectura historica de las condiciones de vida obreras en la ciudad industrial."
        }
      ]
    },
    {
      "id": "ruta-estructural",
      "label": "Ruta estructural",
      "level": "advanced",
      "goal": "Conectar la cuestion de la vivienda con acumulacion, urbanizacion y reproduccion de la fuerza de trabajo.",
      "steps": [
        {
          "position": 1,
          "work_id": "engels-housing-question",
          "note": "Usarlo como puerta de entrada especifica al problema de la vivienda."
        },
        {
          "position": 2,
          "work_id": "marx-capital-volume-one",
          "note": "Leer de forma selectiva para dar marco teorico general a la acumulacion y a las condiciones de vida obrera."
        },
        {
          "position": 3,
          "work_id": "engels-condition-working-class",
          "note": "Volver a la evidencia historica y urbana para cruzarla con el marco teorico."
        }
      ]
    }
  ],
  "related_editorial_articles": [],
  "source_policy": {
    "primary_source_name": "Marxists Internet Archive",
    "link_only": true,
    "allow_excerpt": true,
    "excerpt_max_words": 120,
    "attribution_required": true,
    "notes": "La ficha debe orientar y atribuir. No debe copiar grandes fragmentos ni presentar la lectura editorial como sustituto del archivo original."
  },
  "related_themes": [
    "teoria-del-valor",
    "estado"
  ]
}
