{
  "id": "reforma-revolucion",
  "slug": "reforma-revolucion",
  "title": "Reforma o revolución",
  "summary": "Ficha de orientación para estudiar el debate entre reformismo y ruptura revolucionaria dentro del movimiento obrero socialista.",
  "editorial_intent": "La entrada principal es el folleto de Luxemburg. A partir de ahí conviene releer a Marx sobre programa y transición, y luego cruzar a Lenin y Gramsci para pensar estrategia, táctica y organización.",
  "status": "reviewed",
  "entry_points": [
    {
      "id": "nudo-estrategico",
      "label": "Nudo estratégico",
      "description": "Empieza por la pregunta sobre si las reformas dentro del capitalismo pueden acumularse hasta el socialismo o si este exige una ruptura política y social cualitativa."
    }
  ],
  "study_guidance": {
    "question": "Empieza por la pregunta estratégica decisiva: ¿las reformas son un camino al socialismo o un terreno subordinado a una ruptura más amplia?",
    "start_here": {
      "work_id": "luxemburg-reforma-o-revolucion",
      "why": "Es la entrada más clara porque formula el problema en términos directos y obliga a distinguir entre táctica reformista y estrategia socialista.",
      "focus": "Fíjate en que Luxemburg no rechaza las reformas: discute qué pasa cuando se convierten en sustituto del objetivo de poder."
    },
    "assumes": [
      "No hace falta empezar con toda la historia de la Segunda Internacional.",
      "Conviene fijar primero la fractura entre acumulación de reformas y ruptura antes de abrir el problema de organización."
    ],
    "after_this": {
      "work_id": "critica-programa-gotha",
      "reason": "Después de Luxemburg conviene volver a Marx para pensar programa, transición y las ambigüedades que alimentan soluciones centristas o gradualistas."
    },
    "debate_to_watch": {
      "debate_id": "bernstein-vs-luxemburg",
      "reason": "Ahí se condensa la disputa clásica sobre si el capitalismo puede evolucionar gradualmente hacia el socialismo."
    }
  },
  "key_authors": [
    {
      "id": "luxemburg-rosa",
      "role": "crítica del revisionismo y defensa de la ruptura revolucionaria",
      "why_relevant": "Su intervención condensa de manera ejemplar el debate contra el reformismo de la Segunda Internacional."
    },
    {
      "id": "lenin-vi",
      "role": "estrategia revolucionaria, partido y táctica",
      "why_relevant": "Ayuda a traducir el debate general en problemas de organización, coyuntura y lucha por la hegemonía."
    },
    {
      "id": "gramsci-antonio",
      "role": "hegemonía, guerra de posición y dirección política",
      "why_relevant": "Permite pensar mediaciones, alianzas y temporalidades sin disolver la necesidad de una ruptura con el orden existente."
    },
    {
      "id": "bernstein-eduard",
      "role": "revisión del marxismo y socialismo gradualista",
      "why_relevant": "Su obra 'Las premisas del socialismo y las tareas de la socialdemocracia' es el texto fundacional del reformismo socialista, imprescindible para entender el debate que define la tradición marxista."
    },
    {
      "id": "kautsky-karl",
      "role": "marxismo ortodoxo de la Segunda Internacional",
      "why_relevant": "Encarna la posición centrista que pretendía mantener la ortodoxia marxista sin comprometerse con la acción revolucionaria, criticado tanto por Luxemburg como por Lenin."
    }
  ],
  "essential_works": [
    {
      "work_id": "luxemburg-reforma-o-revolucion",
      "level": "introductory",
      "estimated_effort": "medium",
      "reason_to_read": "Es la lectura central para entrar al debate entre revisión gradualista y revolución socialista."
    },
    {
      "work_id": "critica-programa-gotha",
      "level": "intermediate",
      "estimated_effort": "short",
      "reason_to_read": "Ayuda a discutir programa, transición y límites de los compromisos ambiguos dentro del socialismo."
    },
    {
      "work_id": "que-hacer-lenin",
      "level": "intermediate",
      "estimated_effort": "medium",
      "reason_to_read": "Vincula el debate estratégico con el problema de la conciencia y de la organización política."
    },
    {
      "work_id": "moderno-principe-gramsci",
      "level": "advanced",
      "estimated_effort": "medium",
      "reason_to_read": "Permite pensar la estrategia revolucionaria más allá de la oposición simplista entre espontaneidad y aparato."
    },
    {
      "work_id": "un-paso-adelante-lenin",
      "level": "intermediate",
      "estimated_effort": "medium",
      "reason_to_read": "Aporta una reflexión concreta sobre organización, centralización y lucha interna en el partido obrero."
    }
  ],
  "connected_concepts": [
    {
      "id": "reformismo",
      "label": "Reformismo",
      "relation": "Permite seguir las estrategias que apuestan por una transformación gradual dentro del orden existente."
    },
    {
      "id": "gradualismo",
      "label": "Gradualismo",
      "relation": "Conecta el debate sobre temporalidad política y acumulación de reformas."
    },
    {
      "id": "ruptura-revolucionaria",
      "label": "Ruptura revolucionaria",
      "relation": "Sitúa el problema del salto político y social necesario para superar el capitalismo."
    },
    {
      "id": "socialdemocracia",
      "label": "Socialdemocracia",
      "relation": "Sirve para estudiar el terreno histórico en el que se formuló el debate clásico entre reforma y revolución."
    }
  ],
  "historical_debates": [
    {
      "id": "bernstein-vs-luxemburg",
      "label": "El debate reforma y revolución",
      "description": "Debate sobre si el socialismo puede alcanzarse mediante una ampliación continua de reformas democráticas y sindicales o si ese camino termina integrando al movimiento obrero en el orden capitalista.",
      "participant_author_ids": [
        "bernstein-eduard",
        "luxemburg-rosa",
        "marx-karl"
      ],
      "related_work_ids": [
        "luxemburg-reforma-o-revolucion",
        "critica-programa-gotha"
      ],
      "positions": [
        {
          "author_id": "luxemburg-rosa",
          "work_id": "luxemburg-reforma-o-revolucion",
          "claim": "Las reformas son indispensables, pero si se las convierte en estrategia autosuficiente el socialismo queda disuelto en adaptación al orden existente."
        },
        {
          "author_id": "marx-karl",
          "work_id": "critica-programa-gotha",
          "claim": "Las ambigüedades programáticas y la renuncia a pensar la transición política real terminan vaciando el horizonte comunista."
        }
      ]
    },
    {
      "id": "estrategia-y-tactica",
      "label": "Estrategia y táctica",
      "description": "Debate sobre cómo combinar luchas parciales, organización, hegemonía y perspectiva de ruptura sin caer ni en el maximalismo abstracto ni en la adaptación reformista.",
      "participant_author_ids": [
        "lenin-vi",
        "gramsci-antonio",
        "luxemburg-rosa"
      ],
      "related_work_ids": [
        "luxemburg-reforma-o-revolucion",
        "que-hacer-lenin",
        "un-paso-adelante-lenin",
        "moderno-principe-gramsci"
      ],
      "positions": [
        {
          "author_id": "luxemburg-rosa",
          "work_id": "luxemburg-reforma-o-revolucion",
          "claim": "La lucha parcial solo conserva filo si permanece orientada a una ruptura con el Estado y el orden capitalista."
        },
        {
          "author_id": "lenin-vi",
          "work_id": "que-hacer-lenin",
          "claim": "La estrategia revolucionaria exige organización, claridad política y capacidad de intervenir en coyunturas concretas sin rebajar el objetivo."
        },
        {
          "author_id": "gramsci-antonio",
          "work_id": "moderno-principe-gramsci",
          "claim": "La mediación táctica importa, pero solo si organiza hegemonía y voluntad colectiva en una perspectiva de transformación del poder."
        }
      ]
    }
  ],
  "reading_paths": [
    {
      "id": "ruta-debate-clasico",
      "label": "Ruta debate clásico",
      "level": "introductory",
      "goal": "Entrar al problema clásico del revisionismo y la ruptura revolucionaria.",
      "steps": [
        {
          "position": 1,
          "work_id": "luxemburg-reforma-o-revolucion",
          "note": "Comenzar por la crítica más clara del revisionismo."
        },
        {
          "position": 2,
          "work_id": "critica-programa-gotha",
          "note": "Releer después a Marx para pensar programa, transición y límites de los compromisos."
        }
      ]
    },
    {
      "id": "ruta-estrategia-politica",
      "label": "Ruta estrategia política",
      "level": "intermediate",
      "goal": "Pasar del debate general sobre reformas al problema concreto de la organización y la táctica.",
      "steps": [
        {
          "position": 1,
          "work_id": "luxemburg-reforma-o-revolucion",
          "note": "Mantener este folleto como punto de partida del debate."
        },
        {
          "position": 2,
          "work_id": "que-hacer-lenin",
          "note": "Cruzar la crítica del reformismo con el problema de la conciencia y del partido."
        },
        {
          "position": 3,
          "work_id": "moderno-principe-gramsci",
          "note": "Cerrar con una reflexión sobre hegemonía, organización y dirección política."
        }
      ]
    }
  ],
  "related_editorial_articles": [],
  "related_themes": [
    "partido",
    "revolucion",
    "movimiento-obrero",
    "estado",
    "fascismo"
  ]
}
