{
  "id": "imperialismo",
  "slug": "imperialismo",
  "title": "Imperialismo",
  "summary": "Ficha de orientación para estudiar el imperialismo como fase histórica del capitalismo, sus formas de expansión y sus debates clásicos.",
  "editorial_intent": "Entrada recomendada: el folleto de Lenin, breve y directo. Desde ahí se puede ir a Bujarin para la dimensión económica global, o a Luxemburgo para el debate sobre acumulación y crisis.",
  "status": "reviewed",
  "entry_points": [
    {
      "id": "primera-toma-de-contacto",
      "label": "Primera toma de contacto",
      "description": "Empieza con una vision general del problema antes de entrar en debates teoricos mas densos."
    }
  ],
  "study_guidance": {
    "question": "Empieza por la pregunta práctica: ¿qué vuelve imperialista al capitalismo moderno?",
    "start_here": {
      "work_id": "lenin-imperialism-highest-stage",
      "why": "Es breve, panorámico y te da el vocabulario mínimo antes de entrar en discusiones más técnicas.",
      "focus": "Fíjate en monopolio, capital financiero, exportación de capitales y reparto del mundo como piezas de un mismo cuadro."
    },
    "assumes": [
      "Basta con una idea general de qué es el capitalismo.",
      "No hace falta entrar todavía en debates técnicos sobre acumulación o realización."
    ],
    "after_this": {
      "work_id": "bukharin-imperialism-and-world-economy",
      "reason": "Una vez fijadas las categorías básicas, Bujarin amplía la escala hacia la economía mundial y la rivalidad entre Estados."
    },
    "debate_to_watch": {
      "debate_id": "monopolio-y-capital-financiero",
      "reason": "Te obliga a decidir dónde sitúas el centro explicativo: monopolio, Estado o mercado mundial."
    }
  },
  "key_authors": [
    {
      "id": "lenin-vi",
      "role": "síntesis política y económica",
      "why_relevant": "Ofrece una formulacion panoramica del imperialismo ligada al monopolio, el capital financiero y el reparto del mundo."
    },
    {
      "id": "luxemburg-rosa",
      "role": "debate sobre acumulación y expansión capitalista",
      "why_relevant": "Su trabajo permite entrar en las discusiones sobre acumulacion, expansion hacia espacios no capitalistas y contradicciones del sistema."
    },
    {
      "id": "bukharin",
      "role": "análisis del mercado mundial y la competencia interestatal",
      "why_relevant": "Conecta la economia mundial, la concentracion del capital y la rivalidad entre Estados en una misma lectura del imperialismo."
    },
    {
      "id": "mao-zedong",
      "role": "antiimperialismo y contradicción principal",
      "why_relevant": "Ofrece la perspectiva de un país semicolonial que enfrenta el imperialismo, ampliando el análisis más allá de Europa hacia Asia, África y América Latina."
    }
  ],
  "essential_works": [
    {
      "work_id": "lenin-imperialism-highest-stage",
      "level": "introductory",
      "estimated_effort": "medium",
      "reason_to_read": "Sirve como mapa general para ubicar monopolio, banca, exportacion de capitales y reparto colonial dentro de una sola explicacion."
    },
    {
      "work_id": "luxemburg-accumulation-of-capital",
      "level": "advanced",
      "estimated_effort": "long",
      "reason_to_read": "Abre el debate sobre las condiciones de realizacion y expansion del capital, util para una lectura mas exigente y comparativa."
    },
    {
      "work_id": "bukharin-imperialism-and-world-economy",
      "level": "intermediate",
      "estimated_effort": "long",
      "reason_to_read": "Permite estudiar el imperialismo a escala de economia mundial y entender mejor la articulacion entre capital concentrado y competencia interestatal."
    }
  ],
  "connected_concepts": [
    {
      "id": "capital-financiero",
      "label": "Capital financiero",
      "relation": "Ayuda a explicar la fusion entre banca e industria y la concentracion del poder economico."
    },
    {
      "id": "colonialismo",
      "label": "Colonialismo",
      "relation": "Permite seguir las formas politicas y militares de la expansion imperial."
    },
    {
      "id": "guerra",
      "label": "Guerra",
      "relation": "Conecta el imperialismo con la rivalidad entre potencias y el conflicto por mercados, territorios y zonas de influencia."
    },
    {
      "id": "nacion",
      "label": "Nación",
      "relation": "Abre la relacion entre expansion imperial, cuestion nacional y dominacion sobre pueblos oprimidos."
    }
  ],
  "historical_debates": [
    {
      "id": "monopolio-y-capital-financiero",
      "label": "Monopolio, capital financiero y reparto del mundo",
      "description": "Debate sobre si el rasgo definitorio del imperialismo es la concentracion monopolista, la exportacion de capitales o la reorganizacion del mercado mundial bajo grandes potencias.",
      "participant_author_ids": [
        "lenin-vi",
        "bukharin"
      ],
      "related_work_ids": [
        "lenin-imperialism-highest-stage",
        "bukharin-imperialism-and-world-economy"
      ],
      "positions": [
        {
          "author_id": "lenin-vi",
          "work_id": "lenin-imperialism-highest-stage",
          "claim": "El imperialismo se define por el monopolio, el capital financiero, la exportación de capitales y el reparto del mundo."
        },
        {
          "author_id": "bukharin",
          "work_id": "bukharin-imperialism-and-world-economy",
          "claim": "El fenómeno solo se entiende plenamente desde la economía mundial y la competencia entre bloques estatales capitalistas."
        }
      ]
    },
    {
      "id": "acumulacion-y-expansion",
      "label": "Acumulacion y expansion hacia espacios no capitalistas",
      "description": "Debate sobre como el capitalismo necesita expandirse, absorber nuevos espacios y resolver sus contradicciones de realizacion.",
      "participant_author_ids": [
        "luxemburg-rosa",
        "lenin-vi",
        "bukharin"
      ],
      "related_work_ids": [
        "luxemburg-accumulation-of-capital",
        "lenin-imperialism-highest-stage",
        "bukharin-imperialism-and-world-economy"
      ],
      "positions": [
        {
          "author_id": "luxemburg-rosa",
          "work_id": "luxemburg-accumulation-of-capital",
          "claim": "El capitalismo necesita expandirse hacia espacios no capitalistas para realizar la acumulación y resolver sus límites internos."
        },
        {
          "author_id": "lenin-vi",
          "work_id": "lenin-imperialism-highest-stage",
          "claim": "La clave explicativa está en la fase monopolista y financiera del capital, no en una necesidad externa permanente de mercados no capitalistas."
        },
        {
          "author_id": "bukharin",
          "work_id": "bukharin-imperialism-and-world-economy",
          "claim": "La expansión debe leerse ante todo como dinámica de la economía mundial y rivalidad interestatal, no solo como problema de realización."
        }
      ]
    }
  ],
  "reading_paths": [
    {
      "id": "ruta-basica",
      "label": "Ruta basica",
      "level": "introductory",
      "goal": "Obtener una vision general del imperialismo y sus categorias principales.",
      "steps": [
        {
          "position": 1,
          "work_id": "lenin-imperialism-highest-stage",
          "note": "Leer como mapa inicial del tema, prestando atencion a monopolio, banca, exportacion de capitales y reparto colonial."
        },
        {
          "position": 2,
          "work_id": "bukharin-imperialism-and-world-economy",
          "note": "Usar la introduccion y los primeros capitulos para ampliar la escala hacia la economia mundial y la competencia entre Estados."
        }
      ]
    },
    {
      "id": "ruta-avanzada",
      "label": "Ruta avanzada",
      "level": "advanced",
      "goal": "Comparar enfoques y entrar en los debates clasicos sobre acumulacion, expansion y guerra.",
      "steps": [
        {
          "position": 1,
          "work_id": "lenin-imperialism-highest-stage",
          "note": "Empezar por la sintesis general para fijar el vocabulario basico del tema."
        },
        {
          "position": 2,
          "work_id": "bukharin-imperialism-and-world-economy",
          "note": "Profundizar en la dinamica del mercado mundial y en la articulacion entre capital y Estado."
        },
        {
          "position": 3,
          "work_id": "luxemburg-accumulation-of-capital",
          "note": "Cerrar con una lectura comparativa sobre acumulacion y expansion del capital para abrir el debate teorico."
        }
      ]
    }
  ],
  "related_editorial_articles": [],
  "related_themes": [
    "estado",
    "teoria-del-valor",
    "partido"
  ]
}
