{
  "id": "estado",
  "slug": "estado",
  "title": "Estado",
  "summary": "Ficha de orientación para estudiar el Estado como forma histórica de dominación de clase, sus crisis y su relación con la revolución.",
  "editorial_intent": "Entrada por Lenin: El Estado y la revolución es el texto más sintético y accesible. Desde ahí se puede ir hacia atrás (El origen de la familia de Engels) o hacia adelante (La guerra civil en Francia de Marx).",
  "status": "reviewed",
  "entry_points": [
    {
      "id": "pregunta-central",
      "label": "Pregunta central",
      "description": "Empieza por como Marx y Lenin discuten si la clase trabajadora puede limitarse a ocupar el aparato estatal existente o necesita transformarlo radicalmente."
    }
  ],
  "study_guidance": {
    "question": "Empieza por la pregunta decisiva: ¿la clase trabajadora puede tomar el Estado existente o tiene que romperlo?",
    "start_here": {
      "work_id": "lenin-state-and-revolution",
      "why": "Es el texto más nítido para fijar el problema político central del tema sin perderse todavía en genealogías largas.",
      "focus": "Sigue de cerca la diferencia entre democracia burguesa, destrucción del aparato estatal y dictadura del proletariado."
    },
    "assumes": [
      "No hace falta haber leído El Capital para entrar aquí.",
      "Ayuda saber que la Comuna de París es el trasfondo histórico, pero el propio recorrido te lleva hasta ella."
    ],
    "after_this": {
      "work_id": "marx-civil-war-in-france",
      "reason": "Después de Lenin conviene volver a Marx para ver la experiencia histórica concreta que sostiene ese argumento."
    },
    "debate_to_watch": {
      "debate_id": "tomar-o-destruir-la-maquina-estatal",
      "reason": "Ahí aparece la fractura estratégica que organiza todo el tema."
    }
  },
  "key_authors": [
    {
      "id": "marx-karl",
      "role": "crítica política del Estado burgués",
      "why_relevant": "Permite entrar al tema desde la experiencia de la Comuna de Paris y desde la critica de la maquinaria estatal existente."
    },
    {
      "id": "engels-friedrich",
      "role": "origen histórico del Estado",
      "why_relevant": "Ofrece una lectura historica sobre la aparicion del Estado ligada a la division de clases y a la necesidad de administracion coercitiva."
    },
    {
      "id": "lenin-vi",
      "role": "síntesis revolucionaria del problema del Estado",
      "why_relevant": "Reorganiza el debate sobre Estado, revolucion, democracia y dictadura del proletariado desde una perspectiva estrategica."
    },
    {
      "id": "kollontai-alexandra",
      "role": "Estado, familia y emancipación femenina",
      "why_relevant": "Analizó cómo el Estado y la familia como institución son mecanismos de reproducción de la opresión femenina, y qué papel debe jugar el Estado socialista en su superación."
    }
  ],
  "essential_works": [
    {
      "work_id": "marx-civil-war-in-france",
      "level": "intermediate",
      "estimated_effort": "medium",
      "reason_to_read": "Sirve para estudiar la Comuna de Paris como experiencia historica desde la que Marx replantea el problema del poder politico y la maquinaria estatal."
    },
    {
      "work_id": "engels-origin-family-state",
      "level": "introductory",
      "estimated_effort": "long",
      "reason_to_read": "Aporta una puerta de entrada historica para entender el Estado no como institucion eterna sino como resultado de relaciones sociales determinadas."
    },
    {
      "work_id": "lenin-state-and-revolution",
      "level": "introductory",
      "estimated_effort": "medium",
      "reason_to_read": "Ordena las discusiones sobre destruccion del aparato estatal, democracia burguesa, transicion y dictadura del proletariado en un solo recorrido."
    }
  ],
  "connected_concepts": [
    {
      "id": "comuna-de-paris",
      "label": "Comuna de París",
      "relation": "Permite seguir el problema del poder obrero y la transformacion de la forma estatal."
    },
    {
      "id": "dictadura-del-proletariado",
      "label": "Dictadura del proletariado",
      "relation": "Conecta la discusion sobre transicion revolucionaria y poder politico de la clase trabajadora."
    },
    {
      "id": "democracia-burguesa",
      "label": "Democracia burguesa",
      "relation": "Sirve para comparar formas politicas representativas con la critica marxista del Estado de clase."
    },
    {
      "id": "revolucion",
      "label": "Revolución",
      "relation": "Abre la pregunta por la toma del poder y la reorganizacion de la sociedad."
    }
  ],
  "historical_debates": [
    {
      "id": "tomar-o-destruir-la-maquina-estatal",
      "label": "Tomar o destruir la maquina estatal",
      "description": "Debate sobre si la clase trabajadora puede servirse del aparato estatal existente o debe romperlo y sustituirlo por nuevas formas de poder.",
      "participant_author_ids": [
        "marx-karl",
        "lenin-vi"
      ],
      "related_work_ids": [
        "marx-civil-war-in-france",
        "lenin-state-and-revolution"
      ],
      "positions": [
        {
          "author_id": "marx-karl",
          "work_id": "marx-civil-war-in-france",
          "claim": "La clase trabajadora no puede servirse sin más de la maquinaria estatal existente; la Comuna apunta a una forma política distinta."
        },
        {
          "author_id": "lenin-vi",
          "work_id": "lenin-state-and-revolution",
          "claim": "La lección de Marx obliga a destruir el Estado burgués y sustituirlo por un Estado-Comuna de transición."
        }
      ]
    },
    {
      "id": "origen-historico-del-estado",
      "label": "Origen historico del Estado y division en clases",
      "description": "Debate sobre el caracter historico del Estado, sus funciones de dominacion y su relacion con la propiedad y la reproduccion social.",
      "participant_author_ids": [
        "engels-friedrich",
        "marx-karl",
        "lenin-vi"
      ],
      "related_work_ids": [
        "engels-origin-family-state",
        "marx-civil-war-in-france",
        "lenin-state-and-revolution"
      ],
      "positions": [
        {
          "author_id": "engels-friedrich",
          "work_id": "engels-origin-family-state",
          "claim": "El Estado nace con la división en clases y no es una institución eterna ni neutral."
        },
        {
          "author_id": "marx-karl",
          "work_id": "marx-civil-war-in-france",
          "claim": "La forma estatal solo se entiende plenamente a la luz de luchas históricas concretas como la Comuna."
        },
        {
          "author_id": "lenin-vi",
          "work_id": "lenin-state-and-revolution",
          "claim": "Comprender el origen histórico del Estado importa porque define también su liquidación revolucionaria."
        }
      ]
    }
  ],
  "reading_paths": [
    {
      "id": "ruta-basica",
      "label": "Ruta basica",
      "level": "introductory",
      "goal": "Entender por que el Estado aparece como problema estrategico dentro de la teoria marxista.",
      "steps": [
        {
          "position": 1,
          "work_id": "lenin-state-and-revolution",
          "note": "Leer primero para fijar las preguntas centrales sobre Estado, democracia y revolucion."
        },
        {
          "position": 2,
          "work_id": "marx-civil-war-in-france",
          "note": "Volver a la experiencia de la Comuna para ver de donde sale parte de ese debate."
        }
      ]
    },
    {
      "id": "ruta-historica",
      "label": "Ruta historica",
      "level": "intermediate",
      "goal": "Combinar el origen historico del Estado con el problema politico de su transformacion revolucionaria.",
      "steps": [
        {
          "position": 1,
          "work_id": "engels-origin-family-state",
          "note": "Usar esta lectura para situar el Estado como fenomeno historico ligado a clases y propiedad."
        },
        {
          "position": 2,
          "work_id": "marx-civil-war-in-france",
          "note": "Relacionar el marco historico con una experiencia concreta de poder obrero."
        },
        {
          "position": 3,
          "work_id": "lenin-state-and-revolution",
          "note": "Cerrar con la sistematizacion revolucionaria del debate."
        }
      ]
    }
  ],
  "related_editorial_articles": [],
  "related_themes": [
    "imperialismo",
    "partido",
    "fascismo"
  ]
}
